source_page,text,value_raw,imputed
22,and very large-scale irrigation. The flood plain is important resource for pasture during,,False
22,dry seasons and serves as a refuge during drought conditions for pastoralists. Garissa,,False
22,"hosts three major national reserves namely, Boni, Rahole and Arawale game reserves",,False
22,"and one conservancy called Ishaqbini-Hirola, a sanctuary established to conserve",,False
22,highly endangered Hirola Antelope. The national reserves and conservancies provide,,False
