source_page,text,value_raw,imputed
30,1.3. Education,1.3,False
30,"This sub domain covers educational participation, illiteracy levels, educational institutions and systems,",,False
30,"human and financial resources invested in education, lifelong learning, vocational training and adult",,False
30,"learning, impact of education, assessment of student performance, courses offered in various colleges",,False
30,"and universities, number of teachers and instructors in various learning institutions",,False
