source_page,text,value_raw,imputed
6,"Table 1.1.1: County Population Projection by Sub County and Sex, 2019-2023 ............................................................. 1","1.1, 1, 2019, -2023, 1",False
6,"Table 1.1.2: County Population Projection by Sex, Number of Households and Average Household Size, 2019-2023 .. 1","1.1, 2, 2019, -2023, 1",False
6,"Table 1.1.3: County Population Projection by Sub County, Sex, Number of Households, Land Area and Density, 2019 2","1.1, 3, 2019, 2",False
6,"Table 1.1.4: County Population Projection by Sub County, Land Area and Density, 2019-2023 ..................................... 2","1.1, 4, 2019, -2023, 2",False
6,"Table 1.1.5: County Population Projection by Selected Age Groups and Sex, 2019-2023 .............................................. 3","1.1, 5, 2019, -2023, 3",False
6,"Table 1.1.6: Distribution of Population by 5 Year Age Groups and Sex, 2019-2023 ....................................................... 3","1.1, 6, 5, 2019, -2023, 3",False
6,"Table 1.1.7: Population Trend by Sex, Number of Households, Average Household Size, 1979-2019 ............................ 4","1.1, 7, 1979, -2019, 4",False
6,"Table 1.2.1: Distribution of Population Aged 5 Years and Above by Activity Status, Sub County and Sex, 2019 ......... 21","1.2, 1, 5, 2019, 21",False
